{
  "schema_version": "1.0.0",
  "entry_id": "ENTRY-ECO-031",
  "created_at": "2026-07-12T21:52:14.000Z",
  "created_by": {
    "actor_type": "ai",
    "name": "ChatGPT"
  },
  "scope": "ecosystem",
  "authority_class": "working_context",
  "summary": "TR-ORACLE-BUDGET-1 is ratified as the governing deterministic execution-budget mechanism-and-value policy; implementation remains unauthorized and the next active gate is host-attestation and complete evidence-package schema specification and independent review.",
  "decisions": [],
  "completed_work": [
    "Completed deterministic execution-budget policy specification, adversarial review and correction cycles, exact fingerprinting, final RECOMMEND, and Dan's ratification.",
    "Closed the pre-ratification deterministic execution-budget working phase without beginning implementation."
  ],
  "active_state": {
    "foundation_maintenance_status": "complete",
    "next_substantive_target": "specify-and-review-host-attestation-and-complete-evidence-package-schemas"
  },
  "open_items": [],
  "supersedes": [
    "ENTRY-ECO-029"
  ],
  "evidence": [
    {
      "artifact": "sha256:d940e1e528890597758ffa34f15e20ef1744009c02b42b77c36babb37fb2e732",
      "description": "Ratified TR-ORACLE-BUDGET-1 version 1.0.0-draft.4 source artifact."
    }
  ],
  "next_chat_starting_context": "TR-ORACLE-HOST-1, TR-ORACLE-ABI-1, TR-ORACLE-ENGINE-1, and TR-ORACLE-BUDGET-1 are ratified. Begin specification and independent review of host-attestation and complete evidence-package schemas, including the exact core-receipt schema, only. Rust/WASM implementation, approved-verifier implementation, reference-implementation status, deployment, canonical-evidence production, and merge of fieldmouth-standard PR #1, PR #2, or PR #3 remain unauthorized until all applicable later gates are resolved and approved."
}
