{
  "schema_version": "1.0.0",
  "entry_id": "ENTRY-ECO-026",
  "created_at": "2026-07-11T23:32:19.000Z",
  "created_by": {
    "actor_type": "human",
    "name": "Dan Demarest",
    "account": "daytona3dan-coder"
  },
  "scope": "ecosystem",
  "authority_class": "approved_canon",
  "summary": "Dan ratified TR-ORACLE-ABI-1 draft.5 as the governing ABI specification for Transformation Registry transformation and grading modules while preserving the ratified host architecture, deferring six later gates, and authorizing no implementation.",
  "decisions": [
    "Evidence-producing Transformation Registry oracles must execute within a controlled isolation boundary admitting only versioned deterministic inputs and trusted cryptographic and runtime services.",
    "The canonical implementation posture remains Rust compiled to WebAssembly under an approved host profile; same-realm JavaScript is not an approved evidence-producing boundary.",
    "TR-ORACLE-HOST-1 version 1.0.0-draft.5, SHA-256 55b79d0c023e10e5457a4fc85ae44c2a0bedc34981152d6596bed02868406408, remains the governing architectural host profile.",
    "TR-ORACLE-ABI-1 version 1.0.0-draft.5, SHA-256 270f4be97676d21f3279c9e6bfc7aa8e22de684349259dc267a1598cfd092ae2, is the governing ABI specification for Transformation Registry transformation and grading modules.",
    "The six later gates remain mandatory: engine selection and version policy; deterministic execution-budget policy; host-attestation and complete evidence-package schemas, including the exact core-receipt schema; reproducible-build release threshold; trust-anchor and key-custody mechanisms; and approved-verifier implementation and distribution.",
    "Deferral does not waive any requirement. No Rust/WASM implementation, reference-implementation status, deployment, or canonical-evidence production is authorized until the applicable later gates are separately resolved, reviewed, and approved.",
    "fieldmouth-standard PR #1 remains Draft and BLOCKED. Its JavaScript implementation remains a non-authoritative development and conformance-testing aid only.",
    "The Record remains a private repository on GitHub Free.",
    "GitHub does not enforce protected branches or repository rulesets for private repositories on the Free plan. The Record must not claim that branch protection is technically enforced.",
    "Until repository plan or visibility changes, all intended changes are proposed through branches and pull requests; Record CI must pass before merge; AI review remains advisory; Dan performs the human approval and merge act; direct pushes, force pushes, and deletion of main are prohibited by governance even though GitHub Free cannot technically block them; and Git evidence is checked after each merge.",
    "The repository will not be made public or moved to a paid GitHub plan solely to obtain branch protection.",
    "If repository plan or visibility changes later, technical protection of main must be configured and verified."
  ],
  "completed_work": [
    "Completed five adversarial ABI drafting and review cycles through a final RECOMMEND on the exact draft.5 artifact.",
    "Recorded the ratified ABI by exact identifier, version, SHA-256 identity, byte size, and human authority.",
    "Preserved the ratified host-profile architecture and private GitHub Free operating governance while closing the ABI-definition gate.",
    "Dan Demarest explicitly ratified the ABI architecture and retained all implementation, approval, ratification, and merge authority on July 11, 2026."
  ],
  "active_state": {
    "branch_protection_enforcement": "procedural-not-technical",
    "foundation_maintenance_status": "complete",
    "github_repository_plan": "free",
    "github_repository_visibility": "private",
    "manual_ci_enhancement_status": "closed-without-merge",
    "next_substantive_target": "specify-and-review-wasm-engine-version-policy",
    "state_collision_guard": "enforced-fail-closed",
    "tr_oracle_abi_identifier": "TR-ORACLE-ABI-1",
    "tr_oracle_abi_sha256": "sha256:270f4be97676d21f3279c9e6bfc7aa8e22de684349259dc267a1598cfd092ae2",
    "tr_oracle_abi_status": "ratified-governing-specification",
    "tr_oracle_abi_version": "1.0.0-draft.5",
    "tr_oracle_canonical_implementation": "rust-wasm-approved-host-profile",
    "tr_oracle_host_profile_identifier": "TR-ORACLE-HOST-1",
    "tr_oracle_host_profile_sha256": "sha256:55b79d0c023e10e5457a4fc85ae44c2a0bedc34981152d6596bed02868406408",
    "tr_oracle_host_profile_status": "ratified-governing-architecture",
    "tr_oracle_host_profile_version": "1.0.0-draft.5",
    "tr_oracle_implementation_gate": "six-later-gates-required-before-implementation",
    "tr_oracle_isolation_requirement": "controlled-boundary"
  },
  "open_items": [
    "Select and review the WebAssembly engine and version policy.",
    "Define and review the deterministic execution-budget mechanism and value.",
    "Define and review host-attestation and complete evidence-package formats, including the exact core-receipt schema.",
    "Define and review the reproducible-build release threshold.",
    "Define and review concrete trust-anchor and key-custody mechanisms.",
    "Define and review the approved-verifier implementation and distribution."
  ],
  "supersedes": [
    "ENTRY-ECO-024"
  ],
  "evidence": [
    {
      "artifact": "sha256:270f4be97676d21f3279c9e6bfc7aa8e22de684349259dc267a1598cfd092ae2",
      "description": "Exact ratified TR_ORACLE_ABI_V1.md version 1.0.0-draft.5; 44,616 bytes; final adversarial verdict RECOMMEND."
    }
  ],
  "next_chat_starting_context": "Approved Canon: TR-ORACLE-HOST-1 and TR-ORACLE-ABI-1 version 1.0.0-draft.5 are ratified by exact SHA-256 as the governing oracle architecture and ABI. Six later gates remain mandatory. Next specify and independently review the WebAssembly engine and version policy only. Do not implement Rust/WASM, grant reference status, deploy an oracle, or produce canonical evidence.",
  "approval": {
    "approved_by_type": "human",
    "approved_by_name": "Dan Demarest",
    "approved_by_account": "daytona3dan-coder",
    "approved_at": "2026-07-11T23:32:19.000Z"
  }
}
